{
  "profile": "complex",
  "layer1": {
    "mission": "Coordinate a larger repository with multiple teaching and validation surfaces.",
    "realityAnchors": [
      "docs/SPEC.md",
      "templates/complex/genesis.md",
      "schemas/genesis.schema.json"
    ],
    "boundaryDefinition": {
      "kind": "domain-map",
      "items": [
        "Authority docs",
        "Templates",
        "Examples",
        "Schema and validation workflow"
      ]
    },
    "ownershipAndInterfaces": [
      "Framework docs and contributor workflow must stay synchronized."
    ],
    "invariants": [
      "The three-layer contract stays invariant across every teaching surface."
    ],
    "activeRisks": [
      "A downstream edit can become shadow spec text if review is weak."
    ],
    "nonGoals": [
      "Do not treat schema enforcement as semantic authority."
    ]
  },
  "presentWizard": {
    "requiredEntryFields": [
      "dateOrTimestamp",
      "actor",
      "subsystemsTouched",
      "realityChecked",
      "decisions",
      "changes",
      "verification",
      "crossTeamImpact",
      "openThreads",
      "nextStep"
    ],
    "ledger": [
      {
        "dateOrTimestamp": "2026-04-19T09:00:00Z",
        "actor": "Codex",
        "subsystemsTouched": [
          "README",
          "schema fixtures",
          "validation workflow"
        ],
        "realityChecked": [
          "docs/SPEC.md",
          "docs/GOVERNANCE.md"
        ],
        "decisions": [
          "Use one lightweight workflow with a shared validation script."
        ],
        "changes": [
          "Add release-readiness support without heavy build tooling."
        ],
        "verification": [
          "Run schema and path validation locally."
        ],
        "crossTeamImpact": "Contributors can reuse the same validation script locally and in CI.",
        "openThreads": "none",
        "nextStep": "Keep future automation scoped to low-flake structural checks."
      }
    ]
  },
  "layer3": {
    "readFirst": [
      "Review the authority stack before touching downstream surfaces."
    ],
    "workingRules": [
      "Preserve low-flake validation and avoid workflow ceremony."
    ],
    "updateProtocol": [
      "Update release and validation surfaces when repo mechanics change."
    ]
  }
}
